{"qid": "2025-I-1", "categories": ["AIME-2025-I"], "contexts": ["Find the sum of all integer bases $$b > 9$$ for which $$17_b$$ is a divisor of $97_b$."], "answers": "70", "judge_principle": null, "Question": "Find the sum of all integer bases $$b > 9$$ for which $$17_b$$ is a divisor of $97_b$.", "Answer": "70"}
{"qid": "2025-I-2", "categories": ["AIME-2025-I"], "contexts": ["On $\\triangle ABC$, points $$A, D, E,$$ and $$B$$ lie in that order on side $$\\overline{AB}$$ with $AD = 4$, $DE = 16$, and $EB = 8$. Points $$A, F, G,$$ and $$C$$ lie in that order on side $$\\overline{AC}$$ with $AF = 13$, $FG = 52$, and $GC = 26$. Let $$M$$ be the reflection of $$D$$ through $F$, and let $$N$$ be the reflection of $$G$$ through $E$. Quadrilateral $$DEGF$$ has area 288. Find the area of heptagon $AFNBCEM$.[asy]\nsize(14cm);\npair A = (0, 8);  \npair B = (-4, 0); \npair C = (12, 0); \npair D = A + (B-A)*(4/28);  // AD:AB = 4:28\npair E = A + (B-A)*(20/28); // AE:AB = 20:28\npair F = A + (C-A)*(13/91); // AF:AC = 13:91\npair G = A + (C-A)*(65/91); // AG:AC = 65:91\npair M = F + (F-D); \npair N = E + (E-G);  \nfill(A--E--B--cycle, gray(0.85));  \nfill(E--B--C--cycle, gray(0.85));  \nfill(N--E--M--F--cycle, gray(0.85)); \nfill(A--F--M--cycle, gray(0.85));  \ndraw(A--B--C--cycle, black+linewidth(1));\ndraw(D--E--G--F--cycle, black+linewidth(1));\ndraw(A--F--N--B--C--E--M--cycle, black+linewidth(1));\ndraw(D--F--M, black+linewidth(0.8)); \ndraw(N--E--G, black+linewidth(0.8));\ndot(A); label(\"$A$\", A, N);\ndot(B); label(\"$B$\", B, SW);\ndot(C); label(\"$C$\", C, SE);\ndot(D); label(\"$D$\", D, NW);\ndot(E); label(\"$E$\", E, NW);\ndot(F); label(\"$F$\", F, NE);\ndot(G); label(\"$G$\", G, SE);\ndot(M); label(\"$M$\", M, NE);\ndot(N); label(\"$N$\", N, SW);\n[/asy]"], "answers": "588", "judge_principle": null, "Question": "On $\\triangle ABC$, points $$A, D, E,$$ and $$B$$ lie in that order on side $$\\overline{AB}$$ with $AD = 4$, $DE = 16$, and $EB = 8$. Points $$A, F, G,$$ and $$C$$ lie in that order on side $$\\overline{AC}$$ with $AF = 13$, $FG = 52$, and $GC = 26$. Let $$M$$ be the reflection of $$D$$ through $F$, and let $$N$$ be the reflection of $$G$$ through $E$. Quadrilateral $$DEGF$$ has area 288. Find the area of heptagon $AFNBCEM$.[asy]\nsize(14cm);\npair A = (0, 8);  \npair B = (-4, 0); \npair C = (12, 0); \npair D = A + (B-A)*(4/28);  // AD:AB = 4:28\npair E = A + (B-A)*(20/28); // AE:AB = 20:28\npair F = A + (C-A)*(13/91); // AF:AC = 13:91\npair G = A + (C-A)*(65/91); // AG:AC = 65:91\npair M = F + (F-D); \npair N = E + (E-G);  \nfill(A--E--B--cycle, gray(0.85));  \nfill(E--B--C--cycle, gray(0.85));  \nfill(N--E--M--F--cycle, gray(0.85)); \nfill(A--F--M--cycle, gray(0.85));  \ndraw(A--B--C--cycle, black+linewidth(1));\ndraw(D--E--G--F--cycle, black+linewidth(1));\ndraw(A--F--N--B--C--E--M--cycle, black+linewidth(1));\ndraw(D--F--M, black+linewidth(0.8)); \ndraw(N--E--G, black+linewidth(0.8));\ndot(A); label(\"$A$\", A, N);\ndot(B); label(\"$B$\", B, SW);\ndot(C); label(\"$C$\", C, SE);\ndot(D); label(\"$D$\", D, NW);\ndot(E); label(\"$E$\", E, NW);\ndot(F); label(\"$F$\", F, NE);\ndot(G); label(\"$G$\", G, SE);\ndot(M); label(\"$M$\", M, NE);\ndot(N); label(\"$N$\", N, SW);\n[/asy]", "Answer": "588"}
{"qid": "2025-I-3", "categories": ["AIME-2025-I"], "contexts": ["The 9 members of a baseball team went to an ice-cream parlor after their game. Each player had a single-scoop cone of chocolate, vanilla, or strawberry ice cream. At least one player chose each flavor, and the number of players who chose chocolate was greater than the number of players who chose vanilla, which was greater than the number of players who chose strawberry. Let $$N$$ be the number of different assignments of flavors to players that meet these conditions. Find the remainder when $$N$$ is divided by 1000."], "answers": "16", "judge_principle": null, "Question": "The 9 members of a baseball team went to an ice-cream parlor after their game. Each player had a single-scoop cone of chocolate, vanilla, or strawberry ice cream. At least one player chose each flavor, and the number of players who chose chocolate was greater than the number of players who chose vanilla, which was greater than the number of players who chose strawberry. Let $$N$$ be the number of different assignments of flavors to players that meet these conditions. Find the remainder when $$N$$ is divided by 1000.", "Answer": "16"}
{"qid": "2025-I-4", "categories": ["AIME-2025-I"], "contexts": ["Find the number of ordered pairs $(x,y)$, where both $$x$$ and $$y$$ are integers between -100 and 100, inclusive, such that $12x^2 - xy - 6y^2 = 0$."], "answers": "117", "judge_principle": null, "Question": "Find the number of ordered pairs $(x,y)$, where both $$x$$ and $$y$$ are integers between -100 and 100, inclusive, such that $12x^2 - xy - 6y^2 = 0$.", "Answer": "117"}
{"qid": "2025-I-5", "categories": ["AIME-2025-I"], "contexts": ["There are $$8! = 40320$$ eight-digit positive integers that use each of the digits $$1, 2, 3, 4, 5, 6, 7, 8$$ exactly once. Let $$N$$ be the number of these integers that are divisible by 22. Find the difference between $$N$$ and 2025."], "answers": "279", "judge_principle": null, "Question": "There are $$8! = 40320$$ eight-digit positive integers that use each of the digits $$1, 2, 3, 4, 5, 6, 7, 8$$ exactly once. Let $$N$$ be the number of these integers that are divisible by 22. Find the difference between $$N$$ and 2025.", "Answer": "279"}
{"qid": "2025-I-6", "categories": ["AIME-2025-I"], "contexts": ["An isosceles trapezoid has an inscribed circle tangent to each of its four sides. The radius of the circle is 3, and the area of the trapezoid is 72. Let the parallel sides of the trapezoid have lengths $$r$$ and $s$, with $r \\neq s$. Find $r^2 + s^2$."], "answers": "504", "judge_principle": null, "Question": "An isosceles trapezoid has an inscribed circle tangent to each of its four sides. The radius of the circle is 3, and the area of the trapezoid is 72. Let the parallel sides of the trapezoid have lengths $$r$$ and $s$, with $r \\neq s$. Find $r^2 + s^2$.", "Answer": "504"}
{"qid": "2025-I-7", "categories": ["AIME-2025-I"], "contexts": ["The twelve letters $$A, B, C, D, E, F, G, H, I, J, K,$$ and $$L$$ are randomly grouped into six pairs of letters. The two letters in each pair are placed next to each other in alphabetical order to form six two-letter words, and then those six words are listed alphabetically. For example, a possible result is $AB, CJ, DG, EK, FL, HI$. The probability that the last word listed contains $$G$$ is $\\frac{m}{n}$, where $$m$$ and $$n$$ are relatively prime positive integers. Find $m+n$."], "answers": "821", "judge_principle": null, "Question": "The twelve letters $$A, B, C, D, E, F, G, H, I, J, K,$$ and $$L$$ are randomly grouped into six pairs of letters. The two letters in each pair are placed next to each other in alphabetical order to form six two-letter words, and then those six words are listed alphabetically. For example, a possible result is $AB, CJ, DG, EK, FL, HI$. The probability that the last word listed contains $$G$$ is $\\frac{m}{n}$, where $$m$$ and $$n$$ are relatively prime positive integers. Find $m+n$.", "Answer": "821"}
{"qid": "2025-I-8", "categories": ["AIME-2025-I"], "contexts": ["Let $$k$$ be a real number such that the system\n  [\n  |25+20i-z|=5 \\\n  |z-4-k|=|z-3i-k|\n  ]\n  has exactly one complex solution $z$. The sum of all possible values of $$k$$ can be written as $\\frac{m}{n}$, where $$m$$ and $$n$$ are relatively prime positive integers. Find $m+n$. Here $i=\\sqrt{-1}$."], "answers": "77", "judge_principle": null, "Question": "Let $$k$$ be a real number such that the system\n  [\n  |25+20i-z|=5 \\\n  |z-4-k|=|z-3i-k|\n  ]\n  has exactly one complex solution $z$. The sum of all possible values of $$k$$ can be written as $\\frac{m}{n}$, where $$m$$ and $$n$$ are relatively prime positive integers. Find $m+n$. Here $i=\\sqrt{-1}$.", "Answer": "77"}
{"qid": "2025-I-9", "categories": ["AIME-2025-I"], "contexts": ["The parabola with equation $$y=x^2-4$$ is rotated $$60^\\circ$$ counterclockwise around the origin. The unique point in the fourth quadrant where the original parabola and its image intersect has $y$-coordinate $\\frac{a-\\sqrt{b}}{c}$, where $$a, b,$$ and $$c$$ are positive integers, and $$a$$ and $$c$$ are relatively prime. Find $a+b+c$."], "answers": "62", "judge_principle": null, "Question": "The parabola with equation $$y=x^2-4$$ is rotated $$60^\\circ$$ counterclockwise around the origin. The unique point in the fourth quadrant where the original parabola and its image intersect has $y$-coordinate $\\frac{a-\\sqrt{b}}{c}$, where $$a, b,$$ and $$c$$ are positive integers, and $$a$$ and $$c$$ are relatively prime. Find $a+b+c$.", "Answer": "62"}
{"qid": "2025-I-10", "categories": ["AIME-2025-I"], "contexts": ["The $$27$$ cells of a $$3 \\times 9$$ grid are filled in using the numbers $$1$$ through $$9$$ so that each row contains $$9$$ different numbers, and each of the three $$3 \\times 3$$ blocks heavily outlined in the example below contains $$9$$ different numbers, as in the first three rows of a Sudoku puzzle.[asy]\nimport graph;\nsize(12cm,0);\ndraw((0,0)--(9,0)--(9,3)--(0,3)--cycle);\nfor(int i=1; i<9; ++i) {\n    draw((i,0)--(i,3));\n}\nfor(int i=1; i<3; ++i) {\n    draw((0,i)--(9,i));\n}\ndraw((3,0)--(3,3),linewidth(1pt));\ndraw((6,0)--(6,3),linewidth(1pt));\nstring[][] numbers = {\n    {\"4\",\"2\",\"8\",\"9\",\"6\",\"3\",\"1\",\"7\",\"5\"},\n    {\"3\",\"7\",\"9\",\"5\",\"2\",\"1\",\"6\",\"8\",\"4\"},\n    {\"5\",\"6\",\"1\",\"8\",\"4\",\"7\",\"9\",\"2\",\"3\"}\n};\n\nfor(int i=0; i<3; ++i) {\n    for(int j=0; j<9; ++j) {\n        label(numbers[i][j],(j+0.5,2.5-i));\n    }\n}\n[/asy]The number of different ways to fill such a grid can be written as $p^{a} \\cdot q^{b} \\cdot r^{c} \\cdot s^{d}$, where $p,q,r$, and $s$ are distinct prime numbers and $a,b,c,$ and $d$ are positive integers. Find $p \\cdot a+q \\cdot b+r \\cdot c+s \\cdot d$."], "answers": "81", "judge_principle": null, "Question": "The $$27$$ cells of a $$3 \\times 9$$ grid are filled in using the numbers $$1$$ through $$9$$ so that each row contains $$9$$ different numbers, and each of the three $$3 \\times 3$$ blocks heavily outlined in the example below contains $$9$$ different numbers, as in the first three rows of a Sudoku puzzle.[asy]\nimport graph;\nsize(12cm,0);\ndraw((0,0)--(9,0)--(9,3)--(0,3)--cycle);\nfor(int i=1; i<9; ++i) {\n    draw((i,0)--(i,3));\n}\nfor(int i=1; i<3; ++i) {\n    draw((0,i)--(9,i));\n}\ndraw((3,0)--(3,3),linewidth(1pt));\ndraw((6,0)--(6,3),linewidth(1pt));\nstring[][] numbers = {\n    {\"4\",\"2\",\"8\",\"9\",\"6\",\"3\",\"1\",\"7\",\"5\"},\n    {\"3\",\"7\",\"9\",\"5\",\"2\",\"1\",\"6\",\"8\",\"4\"},\n    {\"5\",\"6\",\"1\",\"8\",\"4\",\"7\",\"9\",\"2\",\"3\"}\n};\n\nfor(int i=0; i<3; ++i) {\n    for(int j=0; j<9; ++j) {\n        label(numbers[i][j],(j+0.5,2.5-i));\n    }\n}\n[/asy]The number of different ways to fill such a grid can be written as $p^{a} \\cdot q^{b} \\cdot r^{c} \\cdot s^{d}$, where $p,q,r$, and $s$ are distinct prime numbers and $a,b,c,$ and $d$ are positive integers. Find $p \\cdot a+q \\cdot b+r \\cdot c+s \\cdot d$.", "Answer": "81"}
{"qid": "2025-I-11", "categories": ["AIME-2025-I"], "contexts": ["A piecewise linear periodic function is defined by\n$$f(x)=\\begin{cases}\nx & \\text{if }x \\in [-1,1) \\\\\n2-x & \\text{if }x \\in [1,3)\n\\end{cases}$$\nand $$f(x+4)=f(x)$$ for all real numbers x. The graph of f(x) has the sawtooth pattern depicted below.\n[asy]\nsize(16cm, 6cm);\npath f = (-8, 0)--(-7, 1)--(-6, 0)--(-5, -1)--(-4, 0)--(-3, 1)--(-2, 0)--\n          (-1, -1)--(0, 0)--(1, 1)--(2, 0)--(3, -1)--(4, 0)--(5, 1)\n          --(6, 0)--(7, -1)--(8, 0)--(9, 1)--(10, 0)--(11, -1);\ndraw(f, purple+linewidth(1)); \ndraw((-8.5, 0)--(10.5, 0), black+linewidth(0.8), EndArrow); \ndraw((0, -2.5)--(0, 2.5), black+linewidth(0.8), EndArrow);  \nfor (int i = -8; i <= 10; i += 2) {\n    draw((i, -0.1)--(i, 0.1), black+linewidth(0.8));\n    label(\"$\"+string(i)+\"$\", (i, -0.4), S); \n}\nfor (int i = -2; i <= 2; i += 1) { \n    draw((-0.1, i)--(0.1, i), black+linewidth(0.8));\n    label(\"$\"+string(i)+\"$\", (-0.4, i), W);\n}\nfor (int i = -8; i <= 10; i += 2) { \n    draw((i, -2.5)--(i, 2.5), gray+dashed);\n}\nfor (int i = -2; i <= 2; i += 1) { \n    draw((-8.5, i)--(10.5, i), gray+dashed);\n}\n[/asy]\nThe parabola $$x=34y^2$$ intersects the graph of $$f(x)$$ at finitely many points. The sum of the $y$-coordinates of these intersection points can be expressed in the form $\\frac{a+b\\sqrt{c}}{d}$, where $a$, $b$, $c$, and $$d$$ are positive integers, $a$, $b$, and $$d$$ have greatest common divisor equal to 1, and $$c$$ is not divisible by the square of any prime. Find $a+b+c+d$."], "answers": "259", "judge_principle": null, "Question": "A piecewise linear periodic function is defined by\n$$f(x)=\\begin{cases}\nx & \\text{if }x \\in [-1,1) \\\\\n2-x & \\text{if }x \\in [1,3)\n\\end{cases}$$\nand $$f(x+4)=f(x)$$ for all real numbers x. The graph of f(x) has the sawtooth pattern depicted below.\n[asy]\nsize(16cm, 6cm);\npath f = (-8, 0)--(-7, 1)--(-6, 0)--(-5, -1)--(-4, 0)--(-3, 1)--(-2, 0)--\n          (-1, -1)--(0, 0)--(1, 1)--(2, 0)--(3, -1)--(4, 0)--(5, 1)\n          --(6, 0)--(7, -1)--(8, 0)--(9, 1)--(10, 0)--(11, -1);\ndraw(f, purple+linewidth(1)); \ndraw((-8.5, 0)--(10.5, 0), black+linewidth(0.8), EndArrow); \ndraw((0, -2.5)--(0, 2.5), black+linewidth(0.8), EndArrow);  \nfor (int i = -8; i <= 10; i += 2) {\n    draw((i, -0.1)--(i, 0.1), black+linewidth(0.8));\n    label(\"$\"+string(i)+\"$\", (i, -0.4), S); \n}\nfor (int i = -2; i <= 2; i += 1) { \n    draw((-0.1, i)--(0.1, i), black+linewidth(0.8));\n    label(\"$\"+string(i)+\"$\", (-0.4, i), W);\n}\nfor (int i = -8; i <= 10; i += 2) { \n    draw((i, -2.5)--(i, 2.5), gray+dashed);\n}\nfor (int i = -2; i <= 2; i += 1) { \n    draw((-8.5, i)--(10.5, i), gray+dashed);\n}\n[/asy]\nThe parabola $$x=34y^2$$ intersects the graph of $$f(x)$$ at finitely many points. The sum of the $y$-coordinates of these intersection points can be expressed in the form $\\frac{a+b\\sqrt{c}}{d}$, where $a$, $b$, $c$, and $$d$$ are positive integers, $a$, $b$, and $$d$$ have greatest common divisor equal to 1, and $$c$$ is not divisible by the square of any prime. Find $a+b+c+d$.", "Answer": "259"}
{"qid": "2025-I-12", "categories": ["AIME-2025-I"], "contexts": ["The set of points in $3$-dimensional coordinate space that lie in the plane $$x+y+z=75$$ whose coordinates satisfy the inequalities\n$$x-yz < y-zx < z-xy$$\nforms three disjoint convex regions. Exactly one of those regions has finite area. The area of this finite region can be expressed in the form $a\\sqrt{b}$, where $$a$$ and $$b$$ are positive integers and $$b$$ is not divisible by the square of any prime. Find $a+b$."], "answers": "510", "judge_principle": null, "Question": "The set of points in $3$-dimensional coordinate space that lie in the plane $$x+y+z=75$$ whose coordinates satisfy the inequalities\n$$x-yz < y-zx < z-xy$$\nforms three disjoint convex regions. Exactly one of those regions has finite area. The area of this finite region can be expressed in the form $a\\sqrt{b}$, where $$a$$ and $$b$$ are positive integers and $$b$$ is not divisible by the square of any prime. Find $a+b$.", "Answer": "510"}
{"qid": "2025-I-13", "categories": ["AIME-2025-I"], "contexts": ["Alex divides a disk into four quadrants with two perpendicular diameters intersecting at the center of the disk. He draws $$25$$ more line segments through the disk, drawing each segment by selecting two points at random on the perimeter of the disk in different quadrants and connecting those two points. Find the expected number of regions into which these $$27$$ line segments divide the disk."], "answers": "204", "judge_principle": null, "Question": "Alex divides a disk into four quadrants with two perpendicular diameters intersecting at the center of the disk. He draws $$25$$ more line segments through the disk, drawing each segment by selecting two points at random on the perimeter of the disk in different quadrants and connecting those two points. Find the expected number of regions into which these $$27$$ line segments divide the disk.", "Answer": "204"}
{"qid": "2025-I-14", "categories": ["AIME-2025-I"], "contexts": ["Let $$ABCDE$$ be a convex pentagon with $AB = 14$, $BC = 7$, $CD = 24$, $DE = 13$, $EA = 26$, and $\\angle B = \\angle E = 60^\\circ$. For each point $$X$$ in the plane, define $f(X) = AX + BX + CX + DX + EX$. The least possible value of $$f(X)$$ can be expressed as $m+n\\sqrt{p}$, where $$m$$ and $$n$$ are positive integers and $$p$$ is not divisible by the square of any prime. Find $m+n+p$."], "answers": "60", "judge_principle": null, "Question": "Let $$ABCDE$$ be a convex pentagon with $AB = 14$, $BC = 7$, $CD = 24$, $DE = 13$, $EA = 26$, and $\\angle B = \\angle E = 60^\\circ$. For each point $$X$$ in the plane, define $f(X) = AX + BX + CX + DX + EX$. The least possible value of $$f(X)$$ can be expressed as $m+n\\sqrt{p}$, where $$m$$ and $$n$$ are positive integers and $$p$$ is not divisible by the square of any prime. Find $m+n+p$.", "Answer": "60"}
{"qid": "2025-I-15", "categories": ["AIME-2025-I"], "contexts": ["Let $$N$$ denote the number of ordered triples of positive integers $$(a,b,c)$$ such that $$a,b,c \\leq 3^6$$ and $$a^3+b^3+c^3$$ is a multiple of $37$. Find the remainder when $$N$$ is divided by $1000$."], "answers": "735", "judge_principle": null, "Question": "Let $$N$$ denote the number of ordered triples of positive integers $$(a,b,c)$$ such that $$a,b,c \\leq 3^6$$ and $$a^3+b^3+c^3$$ is a multiple of $37$. Find the remainder when $$N$$ is divided by $1000$.", "Answer": "735"}
